<?xml version="1.0" encoding="UTF-8"?>
<!--
Diese Datei enth채lt alle Rechte, die in der Benutzerverwaltung definiert und gepr체ft werden.
Die Rollen sind als Beispiel zu verstehen, wie eine Anwendung die Rechte verteilen kann.
Der hier aufgef체hrte Inhalt kann als Startpunkt die rollenrechte.xml der Anwendung 체bertragen werden.
-->
<tns:Anwendung xmlns:tns="http://www.example.org/RollenRechteSchema"
               xmlns:xsi="http://www.w3.org/2001/XMLSchema-instance"
               AnwendungsId="isy-benutzerverwaltung-gui-primefaces"
               xsi:schemaLocation="http://www.example.org/RollenRechteSchema RollenRechteSchema.xsd">

    <tns:rollen RolleId="Benutzer">
        <tns:rechtId Id="Benutzerverwaltung.Benutzer.Aendern.Selbst"/>
    </tns:rollen>
    <tns:rollen RolleId="Administrator">
        <tns:rechtId Id="Benutzerverwaltung.Benutzer.Anlegen"/>
        <tns:rechtId Id="Benutzerverwaltung.Benutzer.Suchen"/>
        <tns:rechtId Id="Benutzerverwaltung.Benutzer.Aendern"/>
        <tns:rechtId Id="Benutzerverwaltung.Benutzer.Loeschen"/>
        <tns:rechtId Id="Benutzerverwaltung.Benutzer.Aendern.Selbst"/>

        <tns:rechtId Id="Benutzerverwaltung.Rolle.Anlegen"/>
        <tns:rechtId Id="Benutzerverwaltung.Rolle.Suchen"/>
        <tns:rechtId Id="Benutzerverwaltung.Rolle.Aendern"/>
        <tns:rechtId Id="Benutzerverwaltung.Rolle.Loeschen"/>
    </tns:rollen>

    <!-- Benutzerverwaltung -->
    <tns:rechte>
        <tns:rechtId Id="Benutzerverwaltung.Benutzer.Anlegen"/>
    </tns:rechte>
    <tns:rechte>
        <tns:rechtId Id="Benutzerverwaltung.Benutzer.Suchen"/>
    </tns:rechte>
    <tns:rechte>
        <tns:rechtId Id="Benutzerverwaltung.Benutzer.Aendern"/>
    </tns:rechte>
    <tns:rechte>
        <tns:rechtId Id="Benutzerverwaltung.Benutzer.Loeschen"/>
    </tns:rechte>
    <tns:rechte>
        <tns:rechtId Id="Benutzerverwaltung.Benutzer.Aendern.Selbst"/>
    </tns:rechte>

    <!-- Rollenverwaltung -->
    <tns:rechte>
        <tns:rechtId Id="Benutzerverwaltung.Rolle.Anlegen"/>
    </tns:rechte>
    <tns:rechte>
        <tns:rechtId Id="Benutzerverwaltung.Rolle.Suchen"/>
    </tns:rechte>
    <tns:rechte>
        <tns:rechtId Id="Benutzerverwaltung.Rolle.Aendern"/>
    </tns:rechte>
    <tns:rechte>
        <tns:rechtId Id="Benutzerverwaltung.Rolle.Loeschen"/>
    </tns:rechte>

</tns:Anwendung>
